{
  "$id": "lena_video_spec_v1.schema.json", "$schema": "https://json-schema.org/draft/2020-12/schema", "type": "object", "additionalProperties": false,
  "required": ["schema_version", "artifact_type", "artifact_id", "property_id", "video_id", "governed_date", "created_at", "generator_version", "upstream_artifacts", "daily_slot", "concept", "hook", "setup", "payoff", "platform", "character_authority_id", "environment_id", "wardrobe_id", "hpe_id", "camera_id", "audio_plan_id", "temporal_performance", "sound_intent", "dialogue_intent", "caption_intent", "business_intent_id", "cost_ceiling_credits", "attempt_authority", "provider_neutral_requirements", "qa_requirements", "provider_prompt_cue", "hard_constraints", "negative_constraints", "user_locks"],
  "properties": {
    "schema_version": {"const": "lena_video_artifact_v1"}, "artifact_type": {"const": "lena_video_spec_v1"}, "artifact_id": {"$ref": "common_defs_v1.schema.json#/$defs/artifact_id"}, "property_id": {"const": "lena"}, "video_id": {"$ref": "common_defs_v1.schema.json#/$defs/video_id"}, "governed_date": {"$ref": "common_defs_v1.schema.json#/$defs/governed_date"}, "created_at": {"$ref": "common_defs_v1.schema.json#/$defs/created_at"}, "generator_version": {"$ref": "common_defs_v1.schema.json#/$defs/slug"}, "upstream_artifacts": {"$ref": "common_defs_v1.schema.json#/$defs/upstream_artifacts"},
    "daily_slot": {"const": "daily_video_01"}, "concept": {"$ref": "common_defs_v1.schema.json#/$defs/nonempty_string"}, "hook": {"$ref": "common_defs_v1.schema.json#/$defs/nonempty_string"}, "setup": {"$ref": "common_defs_v1.schema.json#/$defs/nonempty_string"}, "payoff": {"$ref": "common_defs_v1.schema.json#/$defs/nonempty_string"}, "platform": {"enum": ["instagram_reel", "generic_vertical_social"]}, "character_authority_id": {"$ref": "common_defs_v1.schema.json#/$defs/artifact_id"}, "environment_id": {"$ref": "common_defs_v1.schema.json#/$defs/artifact_id"}, "wardrobe_id": {"$ref": "common_defs_v1.schema.json#/$defs/artifact_id"}, "hpe_id": {"$ref": "common_defs_v1.schema.json#/$defs/artifact_id"}, "camera_id": {"$ref": "common_defs_v1.schema.json#/$defs/artifact_id"}, "audio_plan_id": {"$ref": "common_defs_v1.schema.json#/$defs/artifact_id"}, "temporal_performance": {"$ref": "common_defs_v1.schema.json#/$defs/nonempty_string"}, "sound_intent": {"$ref": "common_defs_v1.schema.json#/$defs/nonempty_string"}, "dialogue_intent": {"$ref": "common_defs_v1.schema.json#/$defs/nonempty_string"}, "caption_intent": {"$ref": "common_defs_v1.schema.json#/$defs/nonempty_string"}, "business_intent_id": {"$ref": "common_defs_v1.schema.json#/$defs/artifact_id"}, "cost_ceiling_credits": {"type": "integer", "minimum": 0, "maximum": 36}, "attempt_authority": {"$ref": "common_defs_v1.schema.json#/$defs/attempt_authority"}, "provider_neutral_requirements": {"$ref": "common_defs_v1.schema.json#/$defs/string_list"}, "qa_requirements": {"$ref": "common_defs_v1.schema.json#/$defs/string_list"}, "provider_prompt_cue": {"$ref": "common_defs_v1.schema.json#/$defs/provider_prompt_cue"}, "hard_constraints": {"$ref": "common_defs_v1.schema.json#/$defs/string_list"}, "negative_constraints": {"$ref": "common_defs_v1.schema.json#/$defs/string_list"}, "user_locks": {"type": "array", "items": {"$ref": "common_defs_v1.schema.json#/$defs/user_lock"}, "minItems": 8, "maxItems": 30, "uniqueItems": true}
  }
}
